<?xml version='1.0' encoding='utf-8'?>
<dataset xmlns:xsi="http://www.w3.org/2001/XMLSchema-instance" xsi:noNamespaceSchemaLocation="../xsd/dataset.xsd">

	<asion_account id="1" code="This is the test text1!" username="Summary1" created_at="2016-05-01" updated_at="2016-05-01"/>
	<asion_account id="2" code="This is the test text2" username="Summary2" created_at="2016-05-01" updated_at="2016-05-01"/>
	<asion_account id="3" code="This is the test text3" username="Summary3" created_at="2016-05-01" updated_at="2016-05-01"/>
	<asion_account id="4" code="This is the test text4" username="Summary4" created_at="2016-05-01" updated_at="2016-05-01"/>
	<asion_account id="5" code="This is the test text5" username="Summary5" created_at="2016-05-01" updated_at="2016-05-01"/>
	<asion_account id="6" code="This is the test text6" username="Summary6" created_at="2016-05-01" updated_at="2016-05-01"/>
	<asion_account id="7" code="This is the test text7" username="Summary7" created_at="2016-05-01" updated_at="2016-05-01"/>
	<asion_account id="8" code="This is the test text8" username="Summary8" created_at="2016-05-01" updated_at="2016-05-01"/>
	<asion_account id="9" code="This is the test text9" username="Summary9" created_at="2016-05-01" updated_at="2016-05-01"/>
	<asion_account id="10" code="This is the test text10" username="Summary10" created_at="2016-05-01" updated_at="2016-05-01"/>
	<asion_account id="11" code="This is the test text11" username="Summary11" created_at="2016-05-01" updated_at="2016-05-01"/>
	<asion_account id="12" code="This is the test text12" username="Summary12" created_at="2016-05-01" updated_at="2016-05-01"/>

</dataset>
